UID,DTSTAMP,DTSTART,DTEND,DURATION,SUMMARY,DESCRIPTION,LOCATION,STATUS,CLASS,TRANSP,PRIORITY,SEQUENCE,RRULE,EXDATE,RDATE,ATTENDEE,ORGANIZER,CATEGORIES,CREATED,LAST-MODIFIED,URL,ATTACH,Validation_Flag
event-133,20250826T1348,20250531T000000Z,20250531T000000Z,P1D,Dragon Boat Festival,"Dragon Boat Festival (Duanwu Jie or Double Fifth Festival) commemorates the death of the Chinese poet Qu Yuan. It is celebrated in China, Taiwan, Malaysia, Singapore and parts of Indonesia. Cultural events involve eating rice dumplings and traditional dragon boat racing.",,,,,,,,,,,,,,20250826T1348,,,
event-134,20250826T1348,20250601T000000Z,20250601T000000Z,P1D,Independence Day: Samoa,,,,,,,,,,,,,,,20250826T1348,,,REQUIRES_VALIDATION
event-135,20250826T1348,20250601T000000Z,20250603T000000Z,P3D,Shavuot,Shavuot is a Jewish celebration of Moses’s descent from Mount Sinai with the Ten Commandments. It is the second of the Jewish pilgrim festivals. Some Jews refrain from working on Shavuot.,,,,,,,,,,,,,,20250826T1348,,,
event-1763432451.619555,20250826T1348,20250601T000000Z,20250630T000000Z,P29D,Pride Month (International),"Pride Month celebrates the diversity of the lesbian, gay, bisexual, transgender and intersex community. ",,,,,,,,,,,,,,20250826T1348,,,
event-136,20250826T1348,20250602T000000Z,20250602T000000Z,P1D,Foundation of the Republic: Italy,,,,,,,,,,,,,,,20250826T1348,,,REQUIRES_VALIDATION
event-1763432451.619557,20250826T1348,20250602T000000Z,20250602T000000Z,P1D,Reconciliation Day,Australian Capital Territory regional holiday,,,,,,,,,,,,,,20250826T1348,,,
event-1763432451.619558,20250826T1348,20250602T000000Z,20250602T000000Z,P1D,Western Australia Day,Western Australia regional holiday,,,,,,,,,,,,,,20250826T1348,,,
event-137,20250826T1348,20250603T000000Z,20250603T000000Z,P1D,Mabo Day,"The Australian High Court delivered the Mabo decision on 3 June 1992, providing legal recognition that Indigenous people have a special relationship with the land. This decision paved the way for land rights known as native title. Mabo Day celebrates the life of activist Eddie Koiki Mabo.",,,,,,,,,,,,,,20250826T1348,,,
event-1763432451.619561,20250826T1348,20250603T000000Z,20250603T000000Z,P1D,Mabo Day (Australia),"The Day ‘commemorates the courageous efforts of Eddie Koiki Mabo to overturn the fiction of ‘terra nullius’ (land belonging to no-one), the legal concept that Australia and the Torres Strait Islands were not owned by Indigenous peoples because they did not ‘use’ the land in ways Europeans believed constituted some kind of legal possession’. The decision paved the way for Native Title legislation. ",,,,,,,,,,,,,,20250826T1348,,,
event-138,20250826T1348,20250604T000000Z,20250609T000000Z,P6D,"The Hajj (Pilgrimage) to Mecca, Saudi Arabia","On specific days of the Islamic month of Zu Al-Hijja, millions of Muslims from around the world congregate in the Prophet’s birthplace of Mecca in Saudi Arabia. The Hajj is obligatory for all Muslims who have the means to undertake it.",,,,,,,,,,,,,,20250826T1348,,,
event-1763432451.619563,20250826T1348,20250605T000000Z,20250605T000000Z,P1D,World Environment Day ,,,,,,,,,,,,,,,20250826T1348,,,REQUIRES_VALIDATION
event-1763432451.619565,20250826T1348,20250606T000000Z,20250606T000000Z,P1D,Eid Al-Adha (International),"Eid Al-Adha, also known as 'the Feast of the Sacrifice', is one of the two major Muslim festivals. ",,,,,,,,,,,,,,20250826T1348,,,
event-139,20250826T1348,20250606T000000Z,20250606T000000Z,P1D,National Day: Sweden,,,,,,,,,,,,,,,20250826T1348,,,REQUIRES_VALIDATION
event-140,20250826T1348,20250606T000000Z,20250610T000000Z,P5D,Eid al Adha,The Eid al Adha means Feast of Sacrifice and commemorates the ordeal of Ibrahim (Abraham) who was asked to sacrifice his only son to prove his faith to Allah (God). The timing of this event is subject to the sighting of the moon) and runs for three to four days.,,,,,,,,,,,,,,20250826T1348,,,
event-141,20250826T1348,20250608T000000Z,20250608T000000Z,P1D,Pentecost,"A festival where Christians celebrate the gift of the Holy Spirit. It is celebrated on the Sunday 50 days after Easter. The name comes from the Greek pentekoste, which means ‘fiftieth’.",,,,,,,,,,,,,,20250826T1348,,,
event-1763432451.619567,20250826T1348,20250609T000000Z,20250615T000000Z,P6D,Men’s Health Week ,,,,,,,,,,,,,,,20250826T1348,,,REQUIRES_VALIDATION
event-142,20250826T1348,20250610T000000Z,20250610T000000Z,P1D,"Portugal Day, Camões Day and Day of Portuguese Communities: Portugal",,,,,,,,,,,,,,,20250826T1348,,,REQUIRES_VALIDATION
event-143,20250826T1348,20250612T000000Z,20250612T000000Z,P1D,Independence Day: Philippines,,,,,,,,,,,,,,,20250826T1348,,,REQUIRES_VALIDATION
event-144,20250826T1348,20250612T000000Z,20250612T000000Z,P1D,National Day: Russian Federation,,,,,,,,,,,,,,,20250826T1348,,,REQUIRES_VALIDATION
event-1763432451.619571,20250826T1348,20250615T000000Z,20250615T000000Z,P1D,Elder Abuse Awareness Day ,,,,,,,,,,,,,,,20250826T1348,,,REQUIRES_VALIDATION
event-1763432451.619572,20250826T1348,20250615T000000Z,20250621T000000Z,P6D,Refugee Week ,,,,,,,,,,,,,,,20250826T1348,,,REQUIRES_VALIDATION
event-1763432451.619573,20250826T1348,20250615T000000Z,20250621T000000Z,P6D,Refugee Week (Australia),"Since early 1945, more than seven million people have come to Australia as new settlers, including around 800 000 people under humanitarian programs, initially as displaced persons and more recently as refugees.  ",,,,,,,,,,,,,,20250826T1348,,,
event-145,20250826T1348,20250615T000000Z,20250621T000000Z,P7D,Refugee Week,Refugee Week is celebrated around the country. It is an opportunity to acknowledge the success of refugees and humanitarian entrants in Australian society.,,,,,,,,,,,,,,20250826T1348,,,
event-146,20250826T1348,20250617T000000Z,20250617T000000Z,P1D,National Day: Iceland,,,,,,,,,,,,,,,20250826T1348,,,REQUIRES_VALIDATION
event-147,20250826T1348,20250618T000000Z,20250618T000000Z,P1D,National Day: Seychelles,,,,,,,,,,,,,,,20250826T1348,,,REQUIRES_VALIDATION
event-148,20250826T1348,20250620T000000Z,20250620T000000Z,P1D,Matariki,Matariki is a New Zealand national holiday to celebrate the first rising of the Pleiades star cluster. This marks the beginning of the new year in the Māori lunar calendar.,,,,,,,,,,,,,,20250826T1348,,,
event-1763432451.619577,20250826T1348,20250620T000000Z,20250620T000000Z,P1D,Matariki (New Zealand),"The rising of Matariki, the star cluster commonly known as Pleiades, signals the beginning of the Māori New Year.",,,,,,,,,,,,,,20250826T1348,,,
event-149,20250826T1348,20250620T000000Z,20250620T000000Z,P1D,World Refugee Day,This day honours refugees and celebrates the strength and courage of people forced to flee their home country to escape conflict or persecution.,,,,,,,,,,,,,,20250826T1348,,,
event-1763432451.619579,20250826T1348,20250620T000000Z,20250620T000000Z,P1D,World Refugee Day ,"‘The Day celebrates the strength and courage of people who have been forced to flee their home country to escape conflict or persecution.' World Refugee Day 'shines a light on the rights, needs and dreams of refugees, helping to mobilise political will and resources so refugees can not only survive but also thrive’. ",,,,,,,,,,,,,,20250826T1348,,,
event-150,20250826T1348,20250623T000000Z,20250623T000000Z,P1D,National Day and Official Birthday of HRH the Grand Duke: Luxembourg,,,,,,,,,,,,,,,20250826T1348,,,REQUIRES_VALIDATION
event-151,20250826T1348,20250625T000000Z,20250625T000000Z,P1D,Independence Day: Mozambique,,,,,,,,,,,,,,,20250826T1348,,,REQUIRES_VALIDATION
event-152,20250826T1348,20250625T000000Z,20250625T000000Z,P1D,National Day: Slovenia,,,,,,,,,,,,,,,20250826T1348,,,REQUIRES_VALIDATION
event-153,20250826T1348,20250626T000000Z,20250626T000000Z,P1D,National Day: Madagascar,,,,,,,,,,,,,,,20250826T1348,,,REQUIRES_VALIDATION
event-154,20250826T1348,20250627T000000Z,20250627T000000Z,P1D,Al Hijri (Islamic New Year),"According to the lunar or Islamic Calendar, Al Hijri (Al Hijrah in Arabic) is the Islamic New Year observed on the first day of Muharram. Muharram is the Islamic Calendar’s first month of the year and is the second holiest month after Ramadan.",,,,,,,,,,,,,,20250826T1348,,,
event-155,20250826T1348,20250627T000000Z,20250627T000000Z,P1D,Independence Day: Djibouti,,,,,,,,,,,,,,,20250826T1348,,,REQUIRES_VALIDATION
event-156,20250826T1348,20250630T000000Z,20250630T000000Z,P1D,Independence Day: Democratic Republic of the Congo,,,,,,,,,,,,,,,20250826T1348,,,REQUIRES_VALIDATION
event-157,20250826T1348,20250701T000000Z,20250701T000000Z,P1D,Canada Day: Canada,,,,,,,,,,,,,,,20250826T1348,,,REQUIRES_VALIDATION
event-1763432451.619587,20250826T1348,20250701T000000Z,20250701T000000Z,P1D,Coming of the Light,The Coming of the Light is celebrated annually by Torres Strait Islander peoples. It marks the adoption of Christianity through island communities during the late nineteenth century.,,,,,,,,,,,,,,20250826T1348,,,
event-1763432451.619588,20250826T1348,20250701T000000Z,20250701T000000Z,P1D,Coming of the Light (Australia),"Celebrated annually by Torres Strait Islander peoples, it marks the adoption of Christianity through island communities during the late 19th century. ",,,,,,,,,,,,,,20250826T1348,,,
event-158,20250826T1348,20250701T000000Z,20250701T000000Z,P1D,Coming of the Light Festival,The Coming of the Light is celebrated by Torres Strait Islanders. It commemorates the arrival of the London Missionary Society on Erub Island in the Torres Strait in 1871. It led to the adoption of Christianity through island communities during the late 19th century.,,,,,,,,,,,,,,20250826T1348,,,
event-159,20250826T1348,20250701T000000Z,20250701T000000Z,P1D,International Tartan Day,"International Tartan Day is a celebration of Scottish heritage. It commemorates the repeal of an English law in 1782 that banned the wearing of tartan. In North America, this day is celebrated on 6 April, the date the Declaration of Arbroath was signed in 1320.",,,,,,,,,,,,,,20250826T1348,,,
event-160,20250826T1348,20250701T000000Z,20250701T000000Z,P1D,National Day: Burundi,,,,,,,,,,,,,,,20250826T1348,,,REQUIRES_VALIDATION
event-161,20250826T1348,20250701T000000Z,20250701T000000Z,P1D,National Day: Somalia,,,,,,,,,,,,,,,20250826T1348,,,REQUIRES_VALIDATION
event-162,20250826T1348,20250703T000000Z,20250703T000000Z,P1D,National Day: Belarus,,,,,,,,,,,,,,,20250826T1348,,,REQUIRES_VALIDATION
event-163,20250826T1348,20250704T000000Z,20250704T000000Z,P1D,Independence Day: United States of America,,,,,,,,,,,,,,,20250826T1348,,,REQUIRES_VALIDATION
event-164,20250826T1348,20250705T000000Z,20250705T000000Z,P1D,Liberation Day: Rwanda,,,,,,,,,,,,,,,20250826T1348,,,REQUIRES_VALIDATION
event-165,20250826T1348,20250705T000000Z,20250705T000000Z,P1D,National Day: Cape Verde,,,,,,,,,,,,,,,20250826T1348,,,REQUIRES_VALIDATION
event-166,20250826T1348,20250705T000000Z,20250705T000000Z,P1D,National Day: Venezuela,,,,,,,,,,,,,,,20250826T1348,,,REQUIRES_VALIDATION
event-167,20250826T1348,20250705T000000Z,20250706T000000Z,P2D,Ashura,"For Sunni Muslims, Ashura marks Noah's departure from the ark and the exodus of Moses from Egypt. It is usually marked by a day of non-obligatory fasting. For Shia Muslims, it marks the anniversary of the martyrdom of Prophet Muhammad's grandson Hussein in Karbala, Iraq. It is commemorated with public processions.",,,,,,,,,,,,,,20250826T1348,,,
event-168,20250826T1348,20250706T000000Z,20250706T000000Z,P1D,National Day: Comoros,,,,,,,,,,,,,,,20250826T1348,,,REQUIRES_VALIDATION
event-169,20250826T1348,20250706T000000Z,20250706T000000Z,P1D,National Day: Malawi,,,,,,,,,,,,,,,20250826T1348,,,REQUIRES_VALIDATION
event-1763432451.619611,20250826T1348,20250706T000000Z,20250713T000000Z,P7D,NAIDOC Week,"NAIDOC Week celebrations are held across Australia to celebrate history, culture and achievements of Aboriginal peoples and Torres Strait Islander peoples.",,,,,,,,,,,,,,20250826T1348,,,
event-1763432451.619613,20250826T1348,20250706T000000Z,20250713T000000Z,P7D,NAIDOC Week ,,,,,,,,,,,,,,,20250826T1348,,,REQUIRES_VALIDATION
event-1763432451.619615,20250826T1348,20250706T000000Z,20250713T000000Z,P7D,NAIDOC Week (Australia),"National Aborigines and Islanders Day Observance Committee (NAIDOC) Week celebrations are held to celebrate the history, culture and achievements of Aboriginal and Torres Strait Islander peoples. The week is an excellent opportunity to participate in a range of activities and to support your local Aboriginal and Torres Strait Islander community.",,,,,,,,,,,,,,20250826T1348,,,
event-171,20250826T1348,20250707T000000Z,20250707T000000Z,P1D,National Day: Solomon Islands,,,,,,,,,,,,,,,20250826T1348,,,REQUIRES_VALIDATION
event-172,20250826T1348,20250709T000000Z,20250709T000000Z,P1D,Independence Day: South Sudan,,,,,,,,,,,,,,,20250826T1348,,,REQUIRES_VALIDATION
event-173,20250826T1348,20250710T000000Z,20250710T000000Z,P1D,Asalha Puja (Dhamma Day),Asalha Puja Day or the Dhamma Day celebrates the first teaching of the Buddha. This Buddhist event commemorates the first sermon delivered by the Buddha after his enlightenment. This event is one of the most important festivals for Theravada Buddhists.,,,,,,,,,,,,,,20250826T1348,,,
event-174,20250826T1348,20250710T000000Z,20250710T000000Z,P1D,Independence Day: Bahamas,,,,,,,,,,,,,,,20250826T1348,,,REQUIRES_VALIDATION
event-175,20250826T1348,20250711T000000Z,20250711T000000Z,P1D,Anniversary of Mongolian People's Revolution: Mongolia,,,,,,,,,,,,,,,20250826T1348,,,REQUIRES_VALIDATION
event-176,20250826T1348,20250712T000000Z,20250712T000000Z,P1D,National Day: Kiribati,,,,,,,,,,,,,,,20250826T1348,,,REQUIRES_VALIDATION
event-177,20250826T1348,20250712T000000Z,20250712T000000Z,P1D,National Day: Sao Tome and Principe,,,,,,,,,,,,,,,20250826T1348,,,REQUIRES_VALIDATION
event-178,20250826T1348,20250713T000000Z,20250713T000000Z,P1D,National Day: Montenegro,,,,,,,,,,,,,,,20250826T1348,,,REQUIRES_VALIDATION
event-179,20250826T1348,20250714T000000Z,20250714T000000Z,P1D,Bastille Day: France,,,,,,,,,,,,,,,20250826T1348,,,REQUIRES_VALIDATION
event-1763432451.619621,20250826T1348,20250714T000000Z,20250714T000000Z,P1D,International Non-Binary People's Day ,Held precisely in between International Men’s Day and International Women’s Day. ,,,,,,,,,,,,,,20250826T1348,,,
event-180,20250826T1348,20250719T000000Z,20250721T000000Z,P3D,Karsa (Mandaean New Year),Karsa marks the beginning of a new year for Mandaeans and is spent and celebrated with family. It begins at dusk and ends 36 hours later.,,,,,,,,,,,,,,20250826T1348,,,
event-181,20250826T1348,20250720T000000Z,20250720T000000Z,P1D,National Day: Colombia,,,,,,,,,,,,,,,20250826T1348,,,REQUIRES_VALIDATION
event-182,20250826T1348,20250721T000000Z,20250721T000000Z,P1D,Accession of King Leopold I (1831): Belgium,,,,,,,,,,,,,,,20250826T1348,,,REQUIRES_VALIDATION
event-183,20250826T1348,20250723T000000Z,20250723T000000Z,P1D,Anniversary of Revolution of 23 July: Egypt,,,,,,,,,,,,,,,20250826T1348,,,REQUIRES_VALIDATION
event-184,20250826T1348,20250726T000000Z,20250726T000000Z,P1D,National Day: Liberia,,,,,,,,,,,,,,,20250826T1348,,,REQUIRES_VALIDATION
event-185,20250826T1348,20250726T000000Z,20250726T000000Z,P1D,National Day: Maldives,,,,,,,,,,,,,,,20250826T1348,,,REQUIRES_VALIDATION
event-186,20250826T1348,20250728T000000Z,20250728T000000Z,P1D,Independence Day: Peru,,,,,,,,,,,,,,,20250826T1348,,,REQUIRES_VALIDATION
event-187,20250826T1348,20250730T000000Z,20250730T000000Z,P1D,Independence Day: Vanuatu,,,,,,,,,,,,,,,20250826T1348,,,REQUIRES_VALIDATION
event-1763432451.619627,20250826T1348,20250730T000000Z,20250730T000000Z,P1D,International Day of Friendship ,"The day was proclaimed in 2011 by the UNGA ‘with the idea that friendship between peoples, countries, cultures and individuals can inspire peace efforts and build bridges between communities.’ ",,,,,,,,,,,,,,20250826T1348,,,
event-188,20250826T1348,20250730T000000Z,20250730T000000Z,P1D,Throne Day: Morocco,,,,,,,,,,,,,,,20250826T1348,,,REQUIRES_VALIDATION
event-189,20250826T1348,20250801T000000Z,20250801T000000Z,P1D,Foundation of the Swiss Confederation: Switzerland,,,,,,,,,,,,,,,20250826T1348,,,REQUIRES_VALIDATION
event-190,20250826T1348,20250801T000000Z,20250801T000000Z,P1D,National Day: Benin,,,,,,,,,,,,,,,20250826T1348,,,REQUIRES_VALIDATION
event-1763432451.61963,20250826T1348,20250804T000000Z,20250804T000000Z,P1D,Bank Holiday,New South Wales bank holiday,,,,,,,,,,,,,,20250826T1348,,,
event-191,20250826T1348,20250804T000000Z,20250804T000000Z,P1D,Constitution Day: Cook Islands,,,,,,,,,,,,,,,20250826T1348,,,REQUIRES_VALIDATION
event-1763432451.619631,20250826T1348,20250804T000000Z,20250804T000000Z,P1D,National Aboriginal & Torres Strait Islander Children's Day (Australia),"NAICD is an opportunity for all Australians to learn about the crucial impact that community, culture and family play in the life of every Aboriginal and Torres Strait Islander child. It was first observed by the Secretariat of National Aboriginal and Islander Child Care in 1988. ",,,,,,,,,,,,,,20250826T1348,,,
event-192,20250826T1348,20250804T000000Z,20250804T000000Z,P1D,National Aboriginal and Torres Strait Islander Children’s Day,National Aboriginal and Torres Strait Islander Children’s Day (NAICD) is a celebration of Indigenous children. NAICD was first observed by the Secretariat of National Aboriginal and Islander Child Care (SNAICC) in 1988.,,,,,,,,,,,,,,20250826T1348,,,
event-1763432451.619633,20250826T1348,20250804T000000Z,20250804T000000Z,P1D,National Aboriginal and Torres Strait Islander Children’s Day ,,,,,,,,,,,,,,,20250826T1348,,,REQUIRES_VALIDATION
event-1763432451.619635,20250826T1348,20250804T000000Z,20250804T000000Z,P1D,National Aboriginal and Torres Strait Islander Children's Day,"National Aboriginal and Torres Strait Islander Children's Day is an opportunity for all Australians to learn about the crucial impact that community, culture and family play in the life of every Aboriginal and Torres Strait Islander child.",,,,,,,,,,,,,,20250826T1348,,,
event-1763432451.619636,20250826T1348,20250804T000000Z,20250804T000000Z,P1D,Picnic Day,Northern Territory regional holiday,,,,,,,,,,,,,,20250826T1348,,,
event-1763432451.619638,20250826T1348,20250804T000000Z,20250810T000000Z,P6D,Homelessness Week ,,,,,,,,,,,,,,,20250826T1348,,,REQUIRES_VALIDATION
event-1763432451.619639,20250826T1348,20250804T000000Z,20250810T000000Z,P6D,Loneliness Awareness Week ,,,,,,,,,,,,,,,20250826T1348,,,REQUIRES_VALIDATION
event-193,20250826T1348,20250806T000000Z,20250806T000000Z,P1D,Hiroshima Day,"Hiroshima Day commemorates those who lost their lives in the bombing of Hiroshima, Japan on 6 August 1945, and to pray for lasting world peace.",,,,,,,,,,,,,,20250826T1348,,,
event-194,20250826T1348,20250806T000000Z,20250806T000000Z,P1D,Independence Day: Bolivia,,,,,,,,,,,,,,,20250826T1348,,,REQUIRES_VALIDATION
event-195,20250826T1348,20250806T000000Z,20250806T000000Z,P1D,National Day: Jamaica,,,,,,,,,,,,,,,20250826T1348,,,REQUIRES_VALIDATION
event-196,20250826T1348,20250807T000000Z,20250807T000000Z,P1D,National Day: Côte d’Ivoire,,,,,,,,,,,,,,,20250826T1348,,,REQUIRES_VALIDATION
event-197,20250826T1348,20250809T000000Z,20250809T000000Z,P1D,International Day of the World’s Indigenous Peoples,The United Nations’ International Day of the World’s Indigenous Peoples encourages people to protect and promote the rights of indigenous peoples.,,,,,,,,,,,,,,20250826T1348,,,
event-1763432451.619643,20250826T1348,20250809T000000Z,20250809T000000Z,P1D,International Day of the World's Indigenous Peoples,"On this day, people from around the world are encouraged to spread the United Nation's message on the protection and promotion of the rights of Indigenous peoples.",,,,,,,,,,,,,,20250826T1348,,,
event-1763432451.619644,20250826T1348,20250809T000000Z,20250809T000000Z,P1D,International Day of the World's  Indigenous People ,Observed annually to promote and protect the rights of the world’s Indigenous population. This event also recognises the achievements and contributions that Indigenous people make to improve world issues such as environmental protection. ,,,,,,,,,,,,,,20250826T1348,,,
event-198,20250826T1348,20250809T000000Z,20250809T000000Z,P1D,Nagasaki Day,Nagasaki Day commemorates the victims of the atomic bombing of the city of Nagasaki in 1945. It is held three days following the observance of Hiroshima Day.,,,,,,,,,,,,,,20250826T1348,,,
event-199,20250826T1348,20250809T000000Z,20250809T000000Z,P1D,National Day: Singapore,,,,,,,,,,,,,,,20250826T1348,,,REQUIRES_VALIDATION
event-200,20250826T1348,20250809T000000Z,20250809T000000Z,P1D,Raksha Bandhan,Raksha Bandhan means bond of protection. This Hindu festival honours the love between brothers and sisters. It is marked by the tying of a rakhi thread by the sister on her brother’s wrist.,,,,,,,,,,,,,,20250826T1348,,,
event-201,20250826T1348,20250811T000000Z,20250811T000000Z,P1D,National Day: Chad,,,,,,,,,,,,,,,20250826T1348,,,REQUIRES_VALIDATION
event-1763432451.619648,20250826T1348,20250812T000000Z,20250812T000000Z,P1D,International Youth Day ,"International Youth Day gives an opportunity to celebrate and mainstream young peoples’ voices, actions and initiatives, as well as their meaningful, universal and equitable engagement. ",,,,,,,,,,,,,,20250826T1348,,,
event-1763432451.61965,20250826T1348,20250813T000000Z,20250813T000000Z,P1D,Ekka Holiday,Queensland (Brisbane City) regional holiday,,,,,,,,,,,,,,20250826T1348,,,
event-202,20250826T1348,20250815T000000Z,20250815T000000Z,P1D,Feast of the Assumption of the Blessed Virgin Mary,This Christian feast day celebrates the belief that God assumed the Virgin Mary into heaven following her death. The Assumption signals the end of Mary’s earthly life and marks her return to heaven to be reunited with Jesus. ,,,,,,,,,,,,,,20250826T1348,,,
event-203,20250826T1348,20250815T000000Z,20250815T000000Z,P1D,"Independence Day: Congo, Republic of",,,,,,,,,,,,,,,20250826T1348,,,REQUIRES_VALIDATION
event-204,20250826T1348,20250815T000000Z,20250815T000000Z,P1D,Independence Day: India,,,,,,,,,,,,,,,20250826T1348,,,REQUIRES_VALIDATION
event-205,20250826T1348,20250815T000000Z,20250815T000000Z,P1D,National Day: Liechtenstein,,,,,,,,,,,,,,,20250826T1348,,,REQUIRES_VALIDATION
event-206,20250826T1348,20250816T000000Z,20250816T000000Z,P1D,Krishna Janmashtami,"Krishna Janmashtami is one of the most important Hindu festivals. This day celebrates the birthday of Lord Krishna, believed to be the eighth reincarnation of Lord Vishnu, who gave the vital message of the Bhagwat Gita – the guiding principles for every Hindu.",,,,,,,,,,,,,,20250826T1348,,,
event-1763432451.619654,20250826T1348,20250816T000000Z,20250816T000000Z,P1D,Krishna Janmashtami (Hinduism),"This festival is one of the most important events in the Hindu calendar. It celebrates the birth of Lord Krishna, a Hindu deity, the eighth avatar of the God Vishnu.",,,,,,,,,,,,,,20250826T1348,,,
event-207,20250826T1348,20250817T000000Z,20250817T000000Z,P1D,National Day: Gabon,,,,,,,,,,,,,,,20250826T1348,,,REQUIRES_VALIDATION
event-208,20250826T1348,20250817T000000Z,20250817T000000Z,P1D,Proclamation of Independence: Indonesia,,,,,,,,,,,,,,,20250826T1348,,,REQUIRES_VALIDATION
event-209,20250826T1348,20250819T000000Z,20250819T000000Z,P1D,Independence Day: Afghanistan,,,,,,,,,,,,,,,20250826T1348,,,REQUIRES_VALIDATION
event-1763432451.619657,20250826T1348,20250819T000000Z,20250819T000000Z,P1D,World Humanitarian Day ,,,,,,,,,,,,,,,20250826T1348,,,REQUIRES_VALIDATION
event-210,20250826T1348,20250820T000000Z,20250820T000000Z,P1D,Day of the Foundation of the State of Hungary and St Stephen's Day: Hungary,,,,,,,,,,,,,,,20250826T1348,,,REQUIRES_VALIDATION
event-211,20250826T1348,20250824T000000Z,20250824T000000Z,P1D,National Day: Ukraine,,,,,,,,,,,,,,,20250826T1348,,,REQUIRES_VALIDATION
event-212,20250826T1348,20250825T000000Z,20250825T000000Z,P1D,Australian South Sea Islanders National Recognition Day,"In 1994, the Commonwealth Government recognised Australian South Sea Islanders as a distinct cultural group. A formal Recognition Statement by the Queensland Government followed this in September 2000.",,,,,,,,,,,,,,20250826T1348,,,
event-213,20250826T1348,20250825T000000Z,20250825T000000Z,P1D,Independence Day: Uruguay,,,,,,,,,,,,,,,20250826T1348,,,REQUIRES_VALIDATION
event-214,20250826T1348,20250826T000000Z,20250827T000000Z,P2D,Ganesh Chaturthi,Ganesh Chaturthi is a Hindu celebration of the birth of Lord Ganesha.,,,,,,,,,,,,,,20250826T1348,,,
event-216,20250826T1348,20250827T000000Z,20250827T000000Z,P1D,"National Day: Moldova, Republic Of",,,,,,,,,,,,,,,20250826T1348,,,REQUIRES_VALIDATION
event-1763432451.619662,20250826T1348,20250829T000000Z,20250829T000000Z,P1D,Wear it Purple Day ,,,,,,,,,,,,,,,20250826T1348,,,REQUIRES_VALIDATION
event-1763432451.619663,20250826T1348,20250829T000000Z,20250829T000000Z,P1D,Wear it Purple Day (Australia),"LGBTIQA+ awareness day – wear it Purple strives to foster supportive, safe, empowering and inclusive environments for rainbow young people. ",,,,,,,,,,,,,,20250826T1348,,,
event-217,20250826T1348,20250831T000000Z,20250831T000000Z,P1D,National Day: Kyrgyzstan,,,,,,,,,,,,,,,20250826T1348,,,REQUIRES_VALIDATION
event-218,20250826T1348,20250831T000000Z,20250831T000000Z,P1D,National Day: Malaysia,,,,,,,,,,,,,,,20250826T1348,,,REQUIRES_VALIDATION
event-219,20250826T1348,20250831T000000Z,20250831T000000Z,P1D,National Day: Trinidad and Tobago,,,,,,,,,,,,,,,20250826T1348,,,REQUIRES_VALIDATION
event-220,20250826T1348,20250901T000000Z,20250901T000000Z,P1D,Constitution Day: Slovak Republic,,,,,,,,,,,,,,,20250826T1348,,,REQUIRES_VALIDATION
event-221,20250826T1348,20250901T000000Z,20250901T000000Z,P1D,National Day: Uzbekistan,,,,,,,,,,,,,,,20250826T1348,,,REQUIRES_VALIDATION
event-222,20250826T1348,20250902T000000Z,20250902T000000Z,P1D,National Day: Vietnam,,,,,,,,,,,,,,,20250826T1348,,,REQUIRES_VALIDATION
